<?xml version="1.0"?>
<proj:akt xsi:schemaLocation="http://ftn.uns.ac.rs/xml file:/D:/Fakultet/4.godina/XWS/XML/XML_Proj_schema_act.xsd" naslov="Odluka o određivanju zona na teritoriji Grada Novog Sada sa koeficijentima za nepokretnosti u zonama za potrebe utvrđivanja poreza na imovinu" drzava="Srbija" opstina="Novi Sad" grad="Novi Sad" ustanova_organ="Skupština Grada Novog Sada" datum_kreiranja="2013-10-23" predlagac="marko" status="u proceduri" kategorija="Odluka" xmlns:proj="http://ftn.uns.ac.rs/xml" xmlns:xsi="http://www.w3.org/2001/XMLSchema-instance">
    <preambula>
        <blok>
            Na osnovu člana 6. stav 3, 4, 5, 6. i 7a. Zakona o porezima na imovinu („ Službeni
            glasnik Republike Srbije“,  broj 26/01,	„ Službeni list SRJ“	broj 42/02 –  Odluka US i
            „ Službeni glasnik Republike Srbije“,	br. 80/02, 80/02 –  dr.	Zakon 135/04, 61/07, 5/09,
            101/10, 24/11, 78/11, 57/12, - Odluka US i 47/13), člana 107. stav 1. Statuta Grada Novog Sada
            – prečišćen tekst („ Službeni list Grada Novog Sada“, broj 43/08), Skupština Grada Novog Sada na XXIII sednici 25. oktobra 2013. godine donosi
        </blok>
    </preambula>
            <proj:clan rbr="1">
                <proj:stav>
                    <tekst>
                        <blok>
                            Ovom odlukom određuju se zone na teritoriji Grada Novog Sada sa naznakom 
                            zone koja se smatra najopremljenijom i utvrđuju koeficijenti za svaku zonu
                            za potrebe utvrđivanja poreza na imovinu.
                        </blok>
                    </tekst>
                </proj:stav>
            </proj:clan>
            <proj:clan rbr="2">
                <proj:stav>
                    <tekst>
                        <blok>U zavisnosti od komunalne opremljenosti, opremljenosti javnim objektima i
                    saobraćajne povezanosti sa centralnim delovima jedinice lokalne samouprave, odnosno
                    radnim zonama i drugim sadržajima u naselju, određuje se pet zona na teritoriji Grada
                    Novog Sada.</blok>
                    </tekst>
                </proj:stav>
            </proj:clan>
            <proj:clan rbr="3">
                <proj:stav>
                    <tekst>
                        <blok>
                            Zone iz člana 2. ove odluke i koeficijenti po zonama su:
                            
                            1. Prva zona – najopremljenija zona obuhvata područja mesnih zajednica:
                            „ Žitni trg“, „ Stari grad“, „ Prva vojvođanska brigada“, „ Sonja Marinković“,
                            „ Liman“, „ Boško Buha“, „ Liman III“, „ Ostrvo“, „ Ivo Andrić“, „ Vera Pavlović“,
                            „7. juli“, „ Narodni heroji“, „ Omladinski pokret“, „ Sava Kovačević“ i „ Dunav“.
                            Koeficijent za nepokretnosti u prvoj zoni – najopremljenijoj zoni – 1,00.

                            2. Druga zona obuhvata područja mesnih zajednica: „ Gavrilo Princip“, 
                            „ Bistrica“, „ Detelinara“, „ Jugovićevo“, „ Radnički“, „ Podbara“, „ Salajka“,
                            „ Petrovaradin“, „ Sremska Kamenica“	i „ Ribnjak“.		
                            Koeficijent za nepokretnosti u drugoj zoni – 0,80.

                            3.	Treća	zona	obuhvata područja	mesnih zajednica:  „ Slana bara“,  „ Klisa“,
                            „ Vidovdansko naselje“,	„ Kać“,  „ Južni Telep“,  „ Bratstvo-Telep“,  „ Nikola Tesla-Telep“,
                            „ Adice“, „	Futog“,	„ Veternik“  i „ Sajlovo“	deo područja koje pripada Mesnoj zajendici
                            „ Jugovićevo“.	
                            Koeficijent za nepokretnosti u trećoj zoni – 0,70.	

                            4.  Četvrta	zona	obuhvata područja	mesnih zajednica:  „ Šangaj“,	„ Rumenka“,
                            „ Stepanovićevo“, „	Čenej“,	„ Pejićevi salaši –	Nemanovci“  i „ Alibegovac“,	„ Artiljevo“,
                            „	Popovica“, „ Puckaroš“, „ Vezirac“, „ Zanoš“  deo područja koje pripada Mesnoj zajednici
                            „	Sremska Kamenica“.  
                            Koeficijent za nepokretnosti u četvrtoj zoni – 0,60.

                            5. Peta zona obuhvata područja mesnih zajednica: „ Bukovac“, „ Ledinci“, „ Stari Ledinci“, „ Begeč“, „ Budisava“, „ Kisač“ i „ Kovilj“.
                            Koeficijent za nepokretnosti u petoj zoni – 0,40
                        </blok>
                    </tekst>
                </proj:stav>
            </proj:clan>
            <proj:clan rbr="4">
                <proj:stav>
                    <tekst>
                        <blok>
                            Ova odluka stupa na snagu narednog dana od dana objavljivanja u „ Službenom listu Grada Novog Sada“,
                            a primenjivaće se na utvrđivanje poreza na imovinu za 2014. godinu.
                        </blok>
                    </tekst>
                </proj:stav>
            </proj:clan>
</proj:akt>
